Page,Comment text,Last edited at
7,"Al revisar las primeras dos pruebas de Chi-cuadrado, noté que aunque se aplican en diferentes circunstancias la de homogeneidad y bondad de ajuste, ambas utilizan la misma funcion en R, chisq.test(). por eso me pregunté, ¿Por que ambas pruebas pueden utilizar el mismo método si se aplican en diferentes contextos?Buscando por internet encontré que ambas pruebas, aunque son conceptualmente diferentes, comparten el mismo fundamento matematico ya que ambas comparan las frecuencias observadas y esperadas utilizando la formula de chi-cuadrado\[ \chi^2 = \sum \frac{(O - E)^2}{E} \]donde O son las frecuencias observadas y E esperadas.R puede usar la misma funcion por que, lo que cambia no es el cálculo, sino como se estructuran los datos y lo que se comparan, una de las pruebas verifica si los datos observados se ajustan a una distribucion teórica (bondad ajuste) y la otra compara las distribuciones entre grupos, pero en pocas palabras, ambas pueden usar la misma funcion por que utilizan la misma estructura matemática.Fuente informacion sobre la prueba Chi-cuadrado",Thu Oct 10 2024 10:35:40 GMT-0300
8,"Estos valores se obtienen al aplicar la formula 8.3 que nos indica el pdf:\( \( E_{ij} = \frac{n_i \cdot n_j}{n} \)Esta se aplica a los valores de la tabla de contingencia para las características de los hongos (Tabla 8.6). Al aplicarla, obtenemos la tabla de frecuencias esperadas para los hongos (Tabla 8.7), en donde todos los valores esperados superan las 5 observaciones.",Fri Oct 11 2024 10:57:56 GMT-0300
8,"Según lo que entiendo, para la tabla 8.5, tenemos una variable que es la proporcion, y ese seria distinto al valor esperado, que esa seria la segunda variable por asi decirlo, en cambio en la tabla de más abajo, la 8.7 todos los valores son valores o frecuencias esperadas, en cambio en la 8.5 tenemos la primera fila que es la proporcion, es por eso que tenemos un valor de 0,""algo"". ",Fri Oct 11 2024 23:16:37 GMT-0300
15,"Correccion en el texto, se utiliza la prueba de McNemar ""mcnemar.test()"".",Thu Oct 10 2024 14:19:21 GMT-0300
20,"El método FDR (False discovery Rate), que fue utilizado en la función cochran.qtest(), lo que hace es que ajusta los valores de p para poder controlar la proporción de faltos positivos entre los resultados que se consideran significativos, es menos conservador que metodos como el bonferroni.Pero comparado con el método de Holm, que es más restricto y asegura un control más estricto del error tipo I, FDR busca el equilibrio al descubrimiento de resultados significativos con la tolernacia de algunos falsos positivos, lo que hace más adecuado cuando se hacen muchas comparaciones.Fuentes:Comparaciones Múltiples : corrección de p-value y FDRTasa de descubrimiento Falso, Definicion simple y ajuste para FDR",Thu Oct 10 2024 22:26:20 GMT-0300